{
  "manifest": {
    "id": 94,
    "title": "Binary Tree Inorder Traversal",
    "slug": "binary-tree-inorder-traversal",
    "difficulty": "Easy",
    "topics": [
      "Tree",
      "Depth-First Search",
      "Binary Tree",
      "Stack"
    ],
    "url": "https://leetcode.com/problems/binary-tree-inorder-traversal/description/",
    "sources": [
      "main.c"
    ],
    "headers": [],
    "signature": "int* inorderTraversal(struct TreeNode* root, int* returnSize);"
  },
  "description": "# 94. Binary Tree Inorder Traversal\n\n**Easy** · [Original problem](https://leetcode.com/problems/binary-tree-inorder-traversal/description/)\n\nProduce an array containing the values encountered during an inorder traversal\nof the supplied binary tree: traverse the left subtree, append the current\nnode's value, then traverse the right subtree.\n\n## Examples\n\n### Example 1\n\n`root = [1,null,2,3]` produces `[1,3,2]`.\n\n![Example 1: a binary tree with root 1, right child 2, and node 3 as the left child of 2.](https://assets.leetcode.com/uploads/2024/08/29/screenshot-2024-08-29-202743.png)\n\n### Example 2\n\n`root = [1,2,3,4,5,null,8,null,null,6,7,9]` produces `[4,2,6,5,7,1,3,9,8]`.\n\n![Example 2: the larger binary tree used to illustrate inorder traversal.](https://assets.leetcode.com/uploads/2024/08/29/tree_2.png)\n\n### Example 3\n\n`root = []` produces `[]`.\n\n### Example 4\n\n`root = [1]` produces `[1]`.\n\nThe tree contains at most 100 nodes, including the possibility of no nodes.\nValues range from -100 through 100. The follow-up asks for an iterative approach.\n\n## Local C contract\n\n```c\nint* inorderTraversal(struct TreeNode* root, int* returnSize);\n```\n\nThe driver converts the `root` JSON field from LeetCode's level-order format,\nwhere `null` represents a missing child. `struct TreeNode` has `val`, `left`,\nand `right` fields. The driver owns all input nodes; do not free them.\nReturn a newly allocated integer array and set `*returnSize` to its length.\nFor an empty tree, returning `NULL` with a length of zero is valid.\nThe driver frees the output array and input tree after serializing the answer.\n\nThe starter is intentionally incomplete. Tests include the official examples,\nnegative values, duplicate values, skewed trees, and a 100-node boundary case.\nExact comparison preserves traversal order; sorting the values is incorrect.\n",
  "files": {
    "main.c": "#include \"wb_tree.h\"\n#include \"solution.h\"\n\nint main(int argc, char **argv) {\n    if (argc != 3) wb_fail(\"expected input and result paths\");\n    WbJson json = wb_load(argv[1]);\n    WbTree tree = wb_tree(&json, wb_field(&json, \"root\"));\n    int resultSize = -1;\n    int *result = inorderTraversal(tree.root, &resultSize);\n    wb_result_array(argv[2], result, resultSize);\n    free(result);\n    wb_tree_free(&tree);\n    wb_json_free(&json);\n    return 0;\n}\n",
    "solution-master.c": "int* inorderTraversal(struct TreeNode* root, int* returnSize) {\n    /* TODO: visit left subtree, current node, then right subtree.\n       Return a heap-allocated array and set *returnSize.\n       The driver owns root and frees the returned array. */\n    (void)root;\n    *returnSize = 0;\n    return NULL;\n}\n",
    "solution.h": "#ifndef WB_SOLUTION_H\n#define WB_SOLUTION_H\n#include <stdlib.h>\n#include <stdbool.h>\n#include <stdio.h>\n#include <string.h>\n#include <limits.h>\n#include <math.h>\n#include \"wb_tree_types.h\"\nint* inorderTraversal(struct TreeNode* root, int* returnSize);\n#endif\n"
  },
  "tests": [
    {
      "id": "example1",
      "input": {
        "root": [
          1,
          null,
          2,
          3
        ]
      },
      "expected": [
        1,
        3,
        2
      ],
      "timeoutMs": 2000,
      "compare": "exact"
    },
    {
      "id": "example2",
      "input": {
        "root": [
          1,
          2,
          3,
          4,
          5,
          null,
          8,
          null,
          null,
          6,
          7,
          9
        ]
      },
      "expected": [
        4,
        2,
        6,
        5,
        7,
        1,
        3,
        9,
        8
      ],
      "timeoutMs": 2000,
      "compare": "exact"
    },
    {
      "id": "empty",
      "input": {
        "root": []
      },
      "expected": [],
      "timeoutMs": 2000,
      "compare": "exact"
    },
    {
      "id": "single",
      "input": {
        "root": [
          1
        ]
      },
      "expected": [
        1
      ],
      "timeoutMs": 2000,
      "compare": "exact"
    },
    {
      "id": "negative-values",
      "input": {
        "root": [
          0,
          -100,
          100
        ]
      },
      "expected": [
        -100,
        0,
        100
      ],
      "timeoutMs": 2000,
      "compare": "exact"
    },
    {
      "id": "duplicates",
      "input": {
        "root": [
          2,
          2,
          2,
          2,
          null,
          null,
          2
        ]
      },
      "expected": [
        2,
        2,
        2,
        2,
        2
      ],
      "timeoutMs": 2000,
      "compare": "exact"
    },
    {
      "id": "left-chain",
      "input": {
        "root": [
          3,
          2,
          null,
          1
        ]
      },
      "expected": [
        1,
        2,
        3
      ],
      "timeoutMs": 2000,
      "compare": "exact"
    },
    {
      "id": "right-chain",
      "input": {
        "root": [
          1,
          null,
          2,
          null,
          3
        ]
      },
      "expected": [
        1,
        2,
        3
      ],
      "timeoutMs": 2000,
      "compare": "exact"
    },
    {
      "id": "unsorted-values",
      "input": {
        "root": [
          1,
          3,
          2
        ]
      },
      "expected": [
        3,
        1,
        2
      ],
      "timeoutMs": 2000,
      "compare": "exact"
    },
    {
      "id": "max-right-chain",
      "input": {
        "root": [
          0,
          null,
          1,
          null,
          2,
          null,
          3,
          null,
          4,
          null,
          5,
          null,
          6,
          null,
          7,
          null,
          8,
          null,
          9,
          null,
          10,
          null,
          11,
          null,
          12,
          null,
          13,
          null,
          14,
          null,
          15,
          null,
          16,
          null,
          17,
          null,
          18,
          null,
          19,
          null,
          20,
          null,
          21,
          null,
          22,
          null,
          23,
          null,
          24,
          null,
          25,
          null,
          26,
          null,
          27,
          null,
          28,
          null,
          29,
          null,
          30,
          null,
          31,
          null,
          32,
          null,
          33,
          null,
          34,
          null,
          35,
          null,
          36,
          null,
          37,
          null,
          38,
          null,
          39,
          null,
          40,
          null,
          41,
          null,
          42,
          null,
          43,
          null,
          44,
          null,
          45,
          null,
          46,
          null,
          47,
          null,
          48,
          null,
          49,
          null,
          50,
          null,
          51,
          null,
          52,
          null,
          53,
          null,
          54,
          null,
          55,
          null,
          56,
          null,
          57,
          null,
          58,
          null,
          59,
          null,
          60,
          null,
          61,
          null,
          62,
          null,
          63,
          null,
          64,
          null,
          65,
          null,
          66,
          null,
          67,
          null,
          68,
          null,
          69,
          null,
          70,
          null,
          71,
          null,
          72,
          null,
          73,
          null,
          74,
          null,
          75,
          null,
          76,
          null,
          77,
          null,
          78,
          null,
          79,
          null,
          80,
          null,
          81,
          null,
          82,
          null,
          83,
          null,
          84,
          null,
          85,
          null,
          86,
          null,
          87,
          null,
          88,
          null,
          89,
          null,
          90,
          null,
          91,
          null,
          92,
          null,
          93,
          null,
          94,
          null,
          95,
          null,
          96,
          null,
          97,
          null,
          98,
          null,
          99
        ]
      },
      "expected": [
        0,
        1,
        2,
        3,
        4,
        5,
        6,
        7,
        8,
        9,
        10,
        11,
        12,
        13,
        14,
        15,
        16,
        17,
        18,
        19,
        20,
        21,
        22,
        23,
        24,
        25,
        26,
        27,
        28,
        29,
        30,
        31,
        32,
        33,
        34,
        35,
        36,
        37,
        38,
        39,
        40,
        41,
        42,
        43,
        44,
        45,
        46,
        47,
        48,
        49,
        50,
        51,
        52,
        53,
        54,
        55,
        56,
        57,
        58,
        59,
        60,
        61,
        62,
        63,
        64,
        65,
        66,
        67,
        68,
        69,
        70,
        71,
        72,
        73,
        74,
        75,
        76,
        77,
        78,
        79,
        80,